<?xml version="1.0" encoding="utf-8" standalone="no"?>
<!DOCTYPE frameset PUBLIC "-//PB//PropBank Frame v3.4 Transitional//EN" "http://propbank.org/specification/dtds/v3.4/frameset.dtd">
<frameset>
  <predicate lemma="radiosensitize">
    <roleset id="radiosensitize.01" name="make cells more senstive to radiation">
      <aliases>
        <alias pos="v">radiosensitize</alias>
      </aliases>
      <roles>
        <role descr="cause of sensitivity" f="PAG" n="0" />
        <role descr="entity becoming senstive" f="PPT" n="1" />
        <role descr="senstive to what" f="GOL" n="2" />
      </roles>
      <usagenotes>
        <usage resource="PropBank" version="1.0" inuse="-" />
        <usage resource="PropBank" version="2.1.5" inuse="-" />
        <usage resource="PropBank" version="3.1" inuse="+" />
        <usage resource="PropBank" version="3.4" inuse="+" />
        <usage resource="AMR" version="2019" inuse="-" />
        <usage resource="PropBank" version="Flickr 1.0" inuse="+" />
        <usage resource="AMR" version="Spatial 1.0" inuse="-" />
        <usage resource="AMR" version="THYME 1.0" inuse="-" />
      </usagenotes>
      <lexlinks />
      <example name="The chemo here is causing the cells to be more susceptable to radiation." src="">
        <text>radiotherapy with radiosensitizing chemo</text>
        <propbank>
          <rel relloc="2">radiosensitizing</rel>
          <arg type="ARG0" start="3" end="3">chemo</arg>
        </propbank>
      </example>
      <note>RADIOSENSITIZE-V NOTES: Based on temprel data. Comparison to sensitize.01. No VN or FN classes. Framed by Katie. (from radiosensitize.01-v)</note>
    </roleset>
  </predicate>
</frameset>