<?xml version="1.0" encoding="utf-8" standalone="no"?>
<!DOCTYPE frameset PUBLIC "-//PB//PropBank Frame v3.4 Transitional//EN" "http://propbank.org/specification/dtds/v3.4/frameset.dtd">
<frameset>
  <predicate lemma="have-org-role">
    <roleset id="have-org-role.91" name="X is in organization Y as Z">
      <aliases>
        <alias pos="v">have-org-role</alias>
        <alias pos="v">have-organization-role</alias>
        <alias pos="v">have-organizational-role</alias>
        <alias pos="v">org-role</alias>
        <alias pos="v">have-role</alias>
      </aliases>
      <roles>
        <role descr="office holder" f="VSP" n="0" />
        <role descr="organization" f="VSP" n="1" />
        <role descr="title of office held" f="VSP" n="2" />
        <role descr="description of responsibility" f="VSP" n="3" />
      </roles>
      <usagenotes>
        <usage resource="PropBank" version="1.0" inuse="-" />
        <usage resource="PropBank" version="2.1.5" inuse="-" />
        <usage resource="PropBank" version="3.1" inuse="-" />
        <usage resource="PropBank" version="3.4" inuse="-" />
        <usage resource="AMR" version="2019" inuse="+" />
        <usage resource="PropBank" version="Flickr 1.0" inuse="-" />
        <usage resource="AMR" version="Spatial 1.0" inuse="+" />
        <usage resource="AMR" version="THYME 1.0" inuse="+" />
      </usagenotes>
      <example name="with organization" src="">
        <text>United Nations Secretary - General Ban Ki - moon</text>
        <propbank>
          <arg end="8" start="5" type="ARG0">Ban Ki - moon</arg>
          <arg end="1" start="0" type="ARG1">United Nations</arg>
          <arg end="4" start="2" type="ARG2">Secretary - General</arg>
        </propbank>
      </example>
      <example name="without organization" src="">
        <text>President Obama</text>
        <propbank>
          <arg end="1" start="1" type="ARG0">Obama</arg>
          <arg end="0" start="0" type="ARG2">President</arg>
        </propbank>
      </example>
      <example name="member" src="">
        <text>Spain is a member of NATO .</text>
        <propbank>
          <arg end="0" start="0" type="ARG0">Spain</arg>
          <arg end="5" start="5" type="ARG1">NATO</arg>
          <arg end="3" start="3" type="ARG2">member</arg>
        </propbank>
      </example>
      <example name="with :ARG3" src="">
        <text>He is the newspaper 's city editor , in charge of local news and assignments to reporters .</text>
        <propbank>
          <arg end="0" start="0" type="ARG0">He</arg>
          <arg end="4" start="3" type="ARG1">newspaper 's</arg>
          <arg end="6" start="5" type="ARG2">city editor</arg>
          <arg end="16" start="11" type="ARG3">local news and assignments to reporters</arg>
        </propbank>
      </example>
      <note>For AMR annotations.</note>
    </roleset>
  </predicate>
  <predicate lemma="have-rel-role">
    <roleset id="have-rel-role.91" name="A and B (of same type) are related, e.g. as family or friends">
      <aliases>
        <alias pos="v">have-rel-role</alias>
        <alias pos="v">have-relation-role</alias>
        <alias pos="v">have-relational-role</alias>
        <alias pos="v">rel-role</alias>
        <alias pos="v">have-role</alias>
      </aliases>
      <roles>
        <role descr="entity A" f="VSP" n="0" />
        <role descr="entity B" f="VSP" n="1" />
        <role descr="role of entity A (must be specified)" f="VSP" n="2" />
        <role descr="role of entity B (often left unspecified)" f="VSP" n="3" />
        <role descr="relationship basis (contract, case; rarely used)" f="VSP" n="4" />
      </roles>
      <usagenotes>
        <usage resource="PropBank" version="1.0" inuse="-" />
        <usage resource="PropBank" version="2.1.5" inuse="-" />
        <usage resource="PropBank" version="3.1" inuse="-" />
        <usage resource="PropBank" version="3.4" inuse="-" />
        <usage resource="AMR" version="2019" inuse="+" />
        <usage resource="PropBank" version="Flickr 1.0" inuse="-" />
        <usage resource="AMR" version="Spatial 1.0" inuse="+" />
        <usage resource="AMR" version="THYME 1.0" inuse="+" />
      </usagenotes>
      <example name="family" src="">
        <text>his mother</text>
        <propbank>
          <arg end="0" start="0" type="ARG0">his</arg>
          <arg end="0" start="0" type="ARG1">his</arg>
          <arg end="1" start="1" type="ARG2">mother</arg>
        </propbank>
      </example>
      <example name="family (both roles specified)" src="">
        <text>John and Mary are husband and wife</text>
        <propbank>
          <arg end="0" start="0" type="ARG0">John</arg>
          <arg end="2" start="2" type="ARG1">Mary</arg>
          <arg end="4" start="4" type="ARG2">husband</arg>
          <arg end="6" start="6" type="ARG3">wife</arg>
        </propbank>
      </example>
      <example name="friend" src="">
        <text>my good old friend Michael</text>
        <propbank>
          <arg end="4" start="4" type="ARG0">Michael</arg>
          <arg end="?" start="?" type="ARG1" />
          <arg end="3" start="2" type="ARG2">old friend</arg>
          <arg end="2" start="2" type="ARGM-MOD">old</arg>
        </propbank>
      </example>
      <example name="lawyer (with ARG4)" src="">
        <text>She is his lawyer in the patent infringement suit .</text>
        <propbank>
          <arg end="0" start="0" type="ARG0">She</arg>
          <arg end="0" start="0" type="ARG1">She</arg>
          <arg end="3" start="3" type="ARG2">lawyer</arg>
          <arg end="8" start="6" type="ARG4">patent infringement suit</arg>
        </propbank>
      </example>
      <example name="sister city" src="">
        <text>Berlin is a sister city of Los Angeles .</text>
        <propbank>
          <arg end="0" start="0" type="ARG0">Berlin</arg>
          <arg end="7" start="6" type="ARG1">Los Angeles</arg>
          <arg end="4" start="3" type="ARG2">sister city</arg>
        </propbank>
      </example>
      <example name="sister cities" src="">
        <text>Berlin and Los Angeles are sister cities .</text>
        <propbank>
          <arg end="0" start="0" type="ARG0">Berlin</arg>
          <arg end="3" start="2" type="ARG1">Los Angeles</arg>
          <arg end="5" start="5" type="ARG2">sister</arg>
          <arg end="5" start="5" type="ARG3">sister</arg>
        </propbank>
      </example>
      <note>For AMR annotations.</note>
    </roleset>
  </predicate>
</frameset>