<?xml version="1.0" encoding="utf-8" standalone="no"?>
<!DOCTYPE frameset PUBLIC "-//PB//PropBank Frame v3.4 Transitional//EN" "http://propbank.org/specification/dtds/v3.4/frameset.dtd">
<frameset>
  <predicate lemma="finetune">
    <roleset id="finetune.01" name="to make small adjustments">
      <aliases>
        <alias pos="v">finetune</alias>
        <alias pos="v">fine-tune</alias>
        <alias pos="n">finetuning</alias>
        <alias pos="n">fine-tuning</alias>
      </aliases>
      <roles>
        <role descr="adjuster, agent" f="PAG" n="0" />
        <role descr="entity fine-tuned" f="PPT" n="1" />
      </roles>
      <usagenotes>
        <usage resource="PropBank" version="1.0" inuse="-" />
        <usage resource="PropBank" version="2.1.5" inuse="-" />
        <usage resource="PropBank" version="3.1" inuse="+" />
        <usage resource="PropBank" version="3.4" inuse="+" />
        <usage resource="AMR" version="2019" inuse="+" />
        <usage resource="PropBank" version="Flickr 1.0" inuse="+" />
        <usage resource="AMR" version="Spatial 1.0" inuse="+" />
        <usage resource="AMR" version="THYME 1.0" inuse="+" />
      </usagenotes>
      <lexlinks />
      <example name="gerund" src="">
        <text>After the study , [the SEC]-1 would be willing [*-1]-2 to consider [*-2] adding new circuit breakers or fine - tuning the current ones , he added [*0*] [*T*-3] .</text>
        <propbank>
          <rel relloc="18 19 20">fine - tuning</rel>
          <arg type="ARG0" start="?" end="?">[*-2]</arg>
          <arg type="ARG1" start="21" end="23">the current ones</arg>
        </propbank>
      </example>
      <note>FINETUNE-V NOTES: Frames file for 'finetune' based on survey of sentences in the WSJ corpus. (from finetune.01-v predicate notes)</note>
    </roleset>
  </predicate>
</frameset>