<?xml version="1.0" encoding="utf-8" standalone="no"?>
<!DOCTYPE frameset PUBLIC "-//PB//PropBank Frame v3.4 Transitional//EN" "http://propbank.org/specification/dtds/v3.4/frameset.dtd">
<frameset>
  <predicate lemma="noncircumferential">
    <roleset id="noncircumferential.01" name="not lying around the edges of">
      <aliases>
        <alias pos="j">noncircumferential</alias>
      </aliases>
      <roles>
        <role descr="thing not lying around the edges" f="PAG" n="1"/>
        <role descr="the edges of what" f="PPT" n="2"/>
      </roles>
      <usagenotes>
        <usage resource="PropBank" version="1.0" inuse="-"/>
        <usage resource="PropBank" version="2.1.5" inuse="-"/>
        <usage resource="PropBank" version="3.1" inuse="+"/>
        <usage resource="PropBank" version="3.4" inuse="+"/>
        <usage resource="AMR" version="2019" inuse="-"/>
        <usage resource="PropBank" version="Flickr 1.0" inuse="+"/>
        <usage resource="AMR" version="Spatial 1.0" inuse="-"/>
        <usage resource="AMR" version="THYME 1.0" inuse="-"/>
      </usagenotes>
      <example name="arg1" src="">
        <text>The colonoscopy revealed a low rectal mass that was noncircumferential .</text>
        <propbank>
          <rel relloc="9">noncircumferential</rel>
          <arg type="ARG1" start="7" end="7">that</arg>
        </propbank>
      </example>
      <note>NONCIRCUMFERENTIAL-J NOTES: Added by Julia based on medi-tmprl1to8. (from noncircumferential.01-j)</note>
    </roleset>
  </predicate>
</frameset>