<?xml version="1.0" encoding="utf-8" standalone="no"?>
<!DOCTYPE frameset PUBLIC "-//PB//PropBank Frame v3.4 Transitional//EN" "http://propbank.org/specification/dtds/v3.4/frameset.dtd">
<frameset>
  <predicate lemma="bisexual">
    <roleset id="bisexual.01" name="attracted to both sexes">
      <aliases>
        <alias pos="j">bisexual</alias>
        <alias pos="j">bi</alias>
      </aliases>
      <roles>
        <role descr="entity attracted to both sexes" f="PAG" n="1"/>
      </roles>
      <usagenotes>
        <usage resource="PropBank" version="1.0" inuse="-"/>
        <usage resource="PropBank" version="2.1.5" inuse="-"/>
        <usage resource="PropBank" version="3.1" inuse="+"/>
        <usage resource="PropBank" version="3.4" inuse="+"/>
        <usage resource="AMR" version="2019" inuse="-"/>
        <usage resource="PropBank" version="Flickr 1.0" inuse="+"/>
        <usage resource="AMR" version="Spatial 1.0" inuse="-"/>
        <usage resource="AMR" version="THYME 1.0" inuse="-"/>
      </usagenotes>
      <lexlinks/>
      <example name="arg1" src="BOLT-4,5">
        <text>Nothing wrong with being bi , but just as bi 's have a taste for guys and girls , some people do n't have a taste for bi 's , if you know what I mean</text>
        <propbank>
          <rel relloc="4">bi</rel>
          </propbank>
      </example>
      <note>BISEXUAL-J NOTES: Added by Julia based on instance of 'bi' in BOLT-4,5. (from bisexual.01-j)</note>
      <note>BI-J NOTES: Automatically created by Julia as an alias file for unification. (from bi.01-j)</note>
    </roleset>
  </predicate>
</frameset>