<?xml version="1.0" encoding="utf-8" standalone="no"?>
<!DOCTYPE frameset PUBLIC "-//PB//PropBank Frame v3.4 Transitional//EN" "http://propbank.org/specification/dtds/v3.4/frameset.dtd">
<frameset>
  <predicate lemma="revisualize">
    <roleset id="revisualize.01" name="look at again">
      <aliases>
        <alias pos="v">revisualize</alias>
      </aliases>
      <roles>
        <role descr="Entity looking; see-er; visionary" f="PAG" n="0"/>
        <role descr="thing seen" f="PPT" n="1"/>
        <role descr="attribute" f="PRD" n="2"/>
      </roles>
      <usagenotes>
        <usage resource="PropBank" version="1.0" inuse="-"/>
        <usage resource="PropBank" version="2.1.5" inuse="-"/>
        <usage resource="PropBank" version="3.1" inuse="+"/>
        <usage resource="PropBank" version="3.4" inuse="+"/>
        <usage resource="AMR" version="2019" inuse="-"/>
        <usage resource="PropBank" version="Flickr 1.0" inuse="+"/>
        <usage resource="AMR" version="Spatial 1.0" inuse="-"/>
        <usage resource="AMR" version="THYME 1.0" inuse="-"/>
      </usagenotes>
      <example name="concrete example" src="">
        <text>We will proceed with a repeat colonoscopy to re - visualize the area</text>
        <propbank>
          <rel relloc="8 9 10">re - visualize</rel>
          <arg type="ARG0" start="0" end="0">We</arg>
          <arg type="ARG1" start="11" end="12">the area</arg>
        </propbank>
      </example>
      <note>REVISUALIZE-V NOTES: Based on temprel data. Comparison to visualize.01. Visualize is a member of VN class characterize-29.2-1-1. No FN class. Framed by Katie. (from revisualize.01-v)</note>
    </roleset>
  </predicate>
</frameset>