<?xml version="1.0" encoding="utf-8" standalone="no"?>
<!DOCTYPE frameset PUBLIC "-//PB//PropBank Frame v3.4 Transitional//EN" "http://propbank.org/specification/dtds/v3.4/frameset.dtd">
<frameset>
  <predicate lemma="euvolemic">
    <roleset id="euvolemic.01" name="having a normal volume of bodily fluids">
      <aliases>
        <alias pos="j">euvolemic</alias>
      </aliases>
      <roles>
        <role descr="entity with a normal volume of fluids" f="PAG" n="1" />
        <role descr="volume measurement" f="VSP" n="2" />
      </roles>
      <usagenotes>
        <usage resource="PropBank" version="1.0" inuse="-" />
        <usage resource="PropBank" version="2.1.5" inuse="-" />
        <usage resource="PropBank" version="3.1" inuse="+" />
        <usage resource="PropBank" version="3.4" inuse="+" />
        <usage resource="AMR" version="2019" inuse="-" />
        <usage resource="PropBank" version="Flickr 1.0" inuse="+" />
        <usage resource="AMR" version="Spatial 1.0" inuse="-" />
        <usage resource="AMR" version="THYME 1.0" inuse="-" />
      </usagenotes>
      <example name="arg1" src="medi-tmprl">
        <text>If her pressures continue to be elevated , I would restart her ACE - inhibitor ; and ongoing evaluation of her volume status would seem to indicate she is euvolemic .</text>
        <propbank>
          <rel relloc="29">euvolemic</rel>
          <arg type="ARG1" start="27" end="27">she</arg>
        </propbank>
      </example>
      <note>EUVOLEMIC-J NOTES: Added by Julia based on medi-tmprl1to8. (from euvolemic.01-j)</note>
    </roleset>
  </predicate>
</frameset>