<?xml version="1.0" encoding="utf-8" standalone="no"?>
<!DOCTYPE frameset PUBLIC "-//PB//PropBank Frame v3.4 Transitional//EN" "http://propbank.org/specification/dtds/v3.4/frameset.dtd">
<frameset>
  <predicate lemma="photocoagulate">
    <roleset id="photocoagulate.01" name="destroy tissue with an intense laser beam">
      <aliases>
        <alias pos="v">photocoagulate</alias>
      </aliases>
      <roles>
        <role descr="doctor/surgeon" f="PAG" n="0"/>
        <role descr="patient, tissues, entity destroyed" f="PPT" n="1"/>
      </roles>
      <usagenotes>
        <usage resource="PropBank" version="1.0" inuse="-"/>
        <usage resource="PropBank" version="2.1.5" inuse="-"/>
        <usage resource="PropBank" version="3.1" inuse="+"/>
        <usage resource="PropBank" version="3.4" inuse="+"/>
        <usage resource="AMR" version="2019" inuse="-"/>
        <usage resource="PropBank" version="Flickr 1.0" inuse="+"/>
        <usage resource="AMR" version="Spatial 1.0" inuse="-"/>
        <usage resource="AMR" version="THYME 1.0" inuse="-"/>
      </usagenotes>
      <example name="photocoagulate-v: arg 1 only" src="">
        <text>This was biopsied extensively and then photocoagulated and tattooed .</text>
        <propbank>
          <rel relloc="6">photocoagulated</rel>
          <arg type="ARGM-TMP" start="5" end="5">then</arg>
          <arg type="ARG1" start="0" end="0">This</arg>
        </propbank>
      </example>
      <note>PHOTOCOAGULATE-V NOTES: Based on Temprel data. No comparison. No VN or FN classes. Framed by Katie. (from photocoagulate.01-v)</note>
    </roleset>
  </predicate>
</frameset>