<?xml version="1.0" encoding="utf-8" standalone="no"?>
<!DOCTYPE frameset PUBLIC "-//PB//PropBank Frame v3.4 Transitional//EN" "http://propbank.org/specification/dtds/v3.4/frameset.dtd">
<frameset>
  <predicate lemma="hypermetabolic">
    <roleset id="hypermetabolic.01" name="having overly high metabolism">
      <aliases>
        <alias pos="j">hypermetabolic</alias>
      </aliases>
      <roles>
        <role descr="hypermetabolic entity" f="PPT" n="1" />
      </roles>
      <usagenotes>
        <usage resource="PropBank" version="1.0" inuse="-" />
        <usage resource="PropBank" version="2.1.5" inuse="-" />
        <usage resource="PropBank" version="3.1" inuse="+" />
        <usage resource="PropBank" version="3.4" inuse="+" />
        <usage resource="AMR" version="2019" inuse="-" />
        <usage resource="PropBank" version="Flickr 1.0" inuse="+" />
        <usage resource="AMR" version="Spatial 1.0" inuse="-" />
        <usage resource="AMR" version="THYME 1.0" inuse="-" />
      </usagenotes>
      <example name="arg1" src="medi-tmprl">
        <text>Previously described hepatic metastasis have resolved and no regions in the liver are hypermetabolic suggesting therapeutic response .</text>
        <propbank>
          <rel relloc="13">hypermetabolic</rel>
          <arg type="ARG1" start="7" end="11">no regions in the liver</arg>
          <arg type="ARGM-ADV" start="14" end="16">suggesting therapeutic response</arg>
        </propbank>
      </example>
      <note>HYPERMETABOLIC-J NOTES: Added by Julia based on medi-tmprl1to8. (from hypermetabolic.01-j)</note>
    </roleset>
  </predicate>
</frameset>