<?xml version="1.0" encoding="utf-8" standalone="no"?>
<!DOCTYPE frameset PUBLIC "-//PB//PropBank Frame v3.4 Transitional//EN" "http://propbank.org/specification/dtds/v3.4/frameset.dtd">
<frameset>
  <predicate lemma="supratherapeutic">
    <roleset id="supratherapeutic.01" name="above the theraputic level">
      <aliases>
        <alias pos="j">supratherapeutic</alias>
      </aliases>
      <roles>
        <role descr="thing measuring about the theraputic level" f="PAG" n="1"/>
        <role descr="measurement" f="VSP" n="2"/>
      </roles>
      <usagenotes>
        <usage resource="PropBank" version="1.0" inuse="-"/>
        <usage resource="PropBank" version="2.1.5" inuse="-"/>
        <usage resource="PropBank" version="3.1" inuse="+"/>
        <usage resource="PropBank" version="3.4" inuse="+"/>
        <usage resource="AMR" version="2019" inuse="-"/>
        <usage resource="PropBank" version="Flickr 1.0" inuse="+"/>
        <usage resource="AMR" version="Spatial 1.0" inuse="-"/>
        <usage resource="AMR" version="THYME 1.0" inuse="-"/>
      </usagenotes>
      <example name="both args" src="medi-tmprl">
        <text>Her INR at that time was noted to be supratherapeutic at 5.7 , so her Coumadin was held .</text>
        <propbank>
          <rel relloc="9">supratherapeutic</rel>
          <arg type="ARG1" start="0" end="4">Her INR at that time</arg>
          <arg type="ARG2" start="10" end="11">at 5.7</arg>
          <arg type="ARGM-ADV" start="13" end="17">so her Coumadin was held</arg>
        </propbank>
      </example>
      <note>SUPRATHERAPEUTIC-J NOTES: Added by Julia based on medi-tmprl1to8. (from supratherapeutic.01-j)</note>
      <note>- (from supratherapeutic.01-j)</note>
    </roleset>
  </predicate>
</frameset>