<?xml version="1.0" encoding="utf-8" standalone="no"?>
<!DOCTYPE frameset PUBLIC "-//PB//PropBank Frame v3.4 Transitional//EN" "http://propbank.org/specification/dtds/v3.4/frameset.dtd">
<frameset>
  <predicate lemma="avidity">
    <roleset id="avidity.01" name="eagerness for, have an eagerness for">
      <aliases>
        <alias pos="j">avid</alias>
        <alias pos="n">avidity</alias>
        <alias pos="j">avidity</alias>
      </aliases>
      <roles>
        <role descr="eager entity" f="PAG" n="0" />
        <role descr="eager for" f="PPT" n="1" />
      </roles>
      <usagenotes>
        <usage resource="PropBank" version="1.0" inuse="-" />
        <usage resource="PropBank" version="2.1.5" inuse="-" />
        <usage resource="PropBank" version="3.1" inuse="+" />
        <usage resource="PropBank" version="3.4" inuse="+" />
        <usage resource="AMR" version="2019" inuse="-" />
        <usage resource="PropBank" version="Flickr 1.0" inuse="+" />
        <usage resource="AMR" version="Spatial 1.0" inuse="-" />
        <usage resource="AMR" version="THYME 1.0" inuse="+" />
      </usagenotes>
      <lexlinks />
      <example name="normal example" src="">
        <text>avidity for learning</text>
        <propbank>
          <rel relloc="0">avidity</rel>
          <arg type="ARG1" start="1" end="2">for learning</arg>
        </propbank>
      </example>
      <example name="medical example" src="">
        <text>A left pelvic lymph node was also PET avid</text>
        <propbank>
          <rel relloc="8">avid</rel>
          <arg type="ARG0" start="0" end="4">A left pelvic lymph node</arg>
          <arg type="ARGM-DIS" start="6" end="6">also</arg>
          <arg type="ARG1" start="7" end="7">PET</arg>
        </propbank>
      </example>
      <example name="both args" src="">
        <text>four lesions are PET - avid</text>
        <propbank>
          <rel relloc="5">avid</rel>
          <arg type="ARG0" start="0" end="1">four lesions</arg>
          <arg type="ARG1" start="3" end="3">PET</arg>
        </propbank>
      </example>
      <note>AVIDITY-J NOTES: Based on Thyme and Sharp data. No comparison. No VN or FN classes. Framed by Katie. (from avidity.01-j)</note>
      <note>AVID-J NOTES: Based on medical notes. Comparison with avidity.01-j. Framed by Katie. (from avid.01-j)</note>
      <note>AVIDITY-N NOTES: Based on Thyme and Sharp data. No comparison. No VN or FN classes. Framed by Katie. (from avidity.01-n)</note>
    </roleset>
  </predicate>
</frameset>
