<?xml version="1.0" encoding="utf-8" standalone="no"?>
<!DOCTYPE frameset PUBLIC "-//PB//PropBank Frame v3.4 Transitional//EN" "http://propbank.org/specification/dtds/v3.4/frameset.dtd">
<frameset>
  <predicate lemma="worthwhile">
    <roleset id="worthwhile.01" name="worthy of spending time on">
      <aliases>
        <alias pos="j">worthwhile</alias>
      </aliases>
      <roles>
        <role descr="worthwhile thing" f="PAG" n="1" />
        <role descr="worthy of what, if explicitly stated" f="PPT" n="2" />
      </roles>
      <usagenotes>
        <usage resource="PropBank" version="1.0" inuse="-" />
        <usage resource="PropBank" version="2.1.5" inuse="-" />
        <usage resource="PropBank" version="3.1" inuse="+" />
        <usage resource="PropBank" version="3.4" inuse="+" />
        <usage resource="AMR" version="2019" inuse="-" />
        <usage resource="PropBank" version="Flickr 1.0" inuse="+" />
        <usage resource="AMR" version="Spatial 1.0" inuse="-" />
        <usage resource="AMR" version="THYME 1.0" inuse="-" />
      </usagenotes>
      <lexlinks />
      <example name="arg1" src="medi-tmprl">
        <text>It would be worthwhile to get a consultation from medical geneticist , and we would arrange for that .</text>
        <propbank>
          <rel relloc="3">worthwhile</rel>
          <arg type="ARGM-MOD" start="1" end="1">would</arg>
          <arg type="ARG1" start="4" end="10">to get a consultation from medical geneticist</arg>
        </propbank>
      </example>
      <example name="both args" src="">
        <text>We sometimes get lost as to what is worthwhile of our attention and what is simply wasting our time .</text>
        <propbank>
          <rel relloc="8">worthwhile</rel>
          <arg type="ARG1" start="6" end="6">what</arg>
          <arg type="ARG2" start="9" end="11">of our attention</arg>
        </propbank>
      </example>
      <note>WORTHWHILE-J NOTES: Added by Julia based on Medi-Tmprl1to8. Relation to worth.02. (from worthwhile.01-j)</note>
    </roleset>
  </predicate>
</frameset>