<?xml version="1.0" encoding="utf-8" standalone="no"?>
<!DOCTYPE frameset PUBLIC "-//PB//PropBank Frame v3.4 Transitional//EN" "http://propbank.org/specification/dtds/v3.4/frameset.dtd">
<frameset>
  <predicate lemma="lyse">
    <roleset id="lyse.01" name="to cause dissolution or destruction of cells by lysins">
      <aliases>
        <alias pos="v">lyse</alias>
        <alias pos="n">lysis</alias>
        <alias pos="n">lysing</alias>
        <alias pos="j">lytic</alias>
      </aliases>
      <roles>
        <role descr="intentional agent of lysis (e.g. scientist)" f="PAG" n="0" />
        <role descr="thing distroyed" f="PPT" n="1" />
        <role descr="instrument, lysin" f="MNR" n="2" />
        <role descr="result of lysis, lysate" f="PRD" n="3" />
      </roles>
      <usagenotes>
        <usage resource="PropBank" version="1.0" inuse="-" />
        <usage resource="PropBank" version="2.1.5" inuse="-" />
        <usage resource="PropBank" version="3.1" inuse="+" />
        <usage resource="PropBank" version="3.4" inuse="+" />
        <usage resource="AMR" version="2019" inuse="+" />
        <usage resource="PropBank" version="Flickr 1.0" inuse="+" />
        <usage resource="AMR" version="Spatial 1.0" inuse="+" />
        <usage resource="AMR" version="THYME 1.0" inuse="+" />
      </usagenotes>
      <lexlinks />
      <example name="lyse-v: intentional agent" src="">
        <text>Thus , we lysed cells transfected with mutant SOD1 at earlier time points .</text>
        <propbank>
          <rel relloc="3">lysed</rel>
          <arg type="ARG0" start="2" end="2">we</arg>
          <arg type="ARG1" start="4" end="8">cells transfected with mutant SOD1</arg>
        </propbank>
      </example>
      <example name="lyse-v: lysate and instrument" src="">
        <text>Red blood cells were lysed from the peripheral blood samples using Immu as previously described .</text>
        <propbank>
          <rel relloc="3 4">were lysed</rel>
          <arg type="ARG3" start="0" end="2">Red blood cells</arg>
          <arg type="ARG1" start="5" end="9">from the peripheral blood samples</arg>
          <arg type="ARG2" start="10" end="11">using Immu</arg>
        </propbank>
      </example>
    </roleset>
  </predicate>
</frameset>