<?xml version="1.0" encoding="utf-8" standalone="no"?>
<!DOCTYPE frameset PUBLIC "-//PB//PropBank Frame v3.4 Transitional//EN" "http://propbank.org/specification/dtds/v3.4/frameset.dtd">
<frameset>
  <predicate lemma="overread">
    <roleset id="overread.01" name="read again more closely, interperate to a greater degree">
      <aliases>
        <alias pos="v">overread</alias>
      </aliases>
      <roles>
        <role descr="reader" f="PAG" n="0" />
        <role descr="thing read" f="PPT" n="1" />
        <role descr="predication, read as" f="PRD" n="2" />
      </roles>
      <usagenotes>
        <usage resource="PropBank" version="1.0" inuse="-" />
        <usage resource="PropBank" version="2.1.5" inuse="-" />
        <usage resource="PropBank" version="3.1" inuse="+" />
        <usage resource="PropBank" version="3.4" inuse="+" />
        <usage resource="AMR" version="2019" inuse="-" />
        <usage resource="PropBank" version="Flickr 1.0" inuse="+" />
        <usage resource="AMR" version="Spatial 1.0" inuse="-" />
        <usage resource="AMR" version="THYME 1.0" inuse="-" />
      </usagenotes>
      <example name="args 0 and 1" src="">
        <text>Although it seems that the left hepatic lobe lesion seen from outside was largely described as benign , we will go ahead and have both the CT as well as MRI over - read here by Texas Elks Care Center .</text>
        <propbank>
          <rel relloc="31 32 33">over - read</rel>
          <arg type="ARG1" start="24" end="30">both the CT as well as MRI</arg>
          <arg type="ARGM-LOC" start="34" end="34">here</arg>
          <arg type="ARG0" start="35" end="39">by Texas Elks Care Center</arg>
        </propbank>
      </example>
      <note>OVERREAD-V NOTES: Based on temprel data. No comparison. No VN or FN classes. Framed by Katie. (from overread.01-v)</note>
    </roleset>
  </predicate>
</frameset>