<?xml version="1.0" encoding="utf-8" standalone="no"?>
<!DOCTYPE frameset PUBLIC "-//PB//PropBank Frame v3.4 Transitional//EN" "http://propbank.org/specification/dtds/v3.4/frameset.dtd">
<frameset>
  <predicate lemma="byline">
    <roleset id="byline.91" name="byline">
      <aliases>
        <alias pos="n">byline</alias>
        <alias pos="n">by-line</alias>
        <alias pos="n">dateline</alias>
        <alias pos="n">date-line</alias>
      </aliases>
      <roles>
        <role descr="news organization" f="VSP" n="0" />
        <role descr="author" f="VSP" n="1" />
        <role descr="photographer, illustrator" f="VSP" n="2" />
        <role descr="translator" f="VSP" n="3" />
        <role descr="means" f="VSP" n="4" />
      </roles>
      <usagenotes>
        <usage resource="PropBank" version="1.0" inuse="-" />
        <usage resource="PropBank" version="2.1.5" inuse="-" />
        <usage resource="PropBank" version="3.1" inuse="-" />
        <usage resource="PropBank" version="3.4" inuse="-" />
        <usage resource="AMR" version="2019" inuse="+" />
        <usage resource="PropBank" version="Flickr 1.0" inuse="-" />
        <usage resource="AMR" version="Spatial 1.0" inuse="+" />
        <usage resource="AMR" version="THYME 1.0" inuse="+" />
      </usagenotes>
      <example name="Xinhua byline" src="">
        <text>Xinhua New Agency , Shanghai , February 10 , by wire ( reporters Jinhu Xie and Chijian Zhang )</text>
        <propbank>
          <rel relloc="9 10">by wire</rel>
          <arg end="2" start="0" type="ARG0">Xinhua New Agency</arg>
          <arg end="18" start="11" type="ARG1">( reporters Jinhu Xie and Chijian Zhang )</arg>
          <arg end="10" start="10" type="ARG4">wire</arg>
          <arg end="7" start="6" type="ARGM-TMP">February 10</arg>
          <arg end="4" start="4" type="ARGM-LOC">Shanghai</arg>
        </propbank>
      </example>
    </roleset>
  </predicate>
</frameset>