<?xml version="1.0" encoding="utf-8" standalone="no"?>
<!DOCTYPE frameset PUBLIC "-//PB//PropBank Frame v3.4 Transitional//EN" "http://propbank.org/specification/dtds/v3.4/frameset.dtd">
<frameset>
  <predicate lemma="irradiate">
    <roleset id="irradiate.01" name="expose to radiation">
      <aliases>
        <alias pos="v">irradiate</alias>
        <alias pos="n">irradiation</alias>
      </aliases>
      <roles>
        <role descr="exposer" f="PAG" n="0"/>
        <role descr="thing exposed" f="PPT" n="1"/>
        <role descr="radiation" f="MNR" n="2"/>
      </roles>
      <usagenotes>
        <usage resource="PropBank" version="1.0" inuse="+"/>
        <usage resource="PropBank" version="2.1.5" inuse="+"/>
        <usage resource="PropBank" version="3.1" inuse="+"/>
        <usage resource="PropBank" version="3.4" inuse="+"/>
        <usage resource="AMR" version="2019" inuse="+"/>
        <usage resource="PropBank" version="Flickr 1.0" inuse="+"/>
        <usage resource="AMR" version="Spatial 1.0" inuse="+"/>
        <usage resource="AMR" version="THYME 1.0" inuse="+"/>
      </usagenotes>
      <lexlinks/>
      <example name="ARG1" src="ontonotes nw/wsj/09/wsj_0999">
        <text>`` The -LCB- stones -RCB- that were irradiated in the U.S. are safe , '' says John Hickey , chief of the NRC operations branch , Washington .</text>
        <propbank>
          <rel relloc="7">irradiated</rel>
          <arg type="ARG1" start="1" end="4">The -LCB- stones -RCB-</arg>
          <arg type="ARGM-LOC" start="8" end="10">in the U.S.</arg>
          <arg type="R-ARG1" start="5" end="5">that</arg>
        </propbank>
      </example>
      <example name="all args" src="">
        <text>John irradiated his underwear with weapons - grade plutonium .</text>
        <propbank>
          <rel relloc="1">irradiated</rel>
          <arg type="ARG0" start="0" end="0">John</arg>
          <arg type="ARG1" start="2" end="3">his underwear</arg>
          <arg type="ARG2" start="4" end="8">with weapons - grade plutonium</arg>
        </propbank>
      </example>
      <example name="Arg0,1" src="">
        <text>While the radioactive isotopes finding their way into pollen grains were relatively few , their irradiation of pollen from within the pollen grains was significant .</text>
        <propbank>
          <rel relloc="15">irradiation</rel>
          <arg type="ARG0" start="14" end="14">their</arg>
          <arg type="ARG1" start="16" end="22">of pollen from within the pollen grains</arg>
        </propbank>
      </example>
      <note>IRRADIATE-V NOTES: Frames file for 'irradiate' based on sentences in wsj. No Verbnet entry. (from irradiate.01-v predicate notes)</note>
      <note>IRRADIATION-N NOTES: (from irradiation.01-n)</note>
    </roleset>
  </predicate>
</frameset>