<?xml version="1.0" encoding="utf-8" standalone="no"?>
<!DOCTYPE frameset PUBLIC "-//PB//PropBank Frame v3.4 Transitional//EN" "http://propbank.org/specification/dtds/v3.4/frameset.dtd">
<frameset>
  <predicate lemma="instead-of">
    <roleset id="instead-of.91" name="instead of, as opposed to, rather than">
      <aliases>
        <alias pos="m">instead-of</alias>
        <alias pos="m">instead</alias>
        <alias pos="m">as-opposed-to</alias>
        <alias pos="m">rather-than</alias>
        <alias pos="m">not-x-but-y</alias>
      </aliases>
      <roles>
        <role descr="this" f="VSP" n="1" />
        <role descr="instead of that" f="VSP" n="2" />
      </roles>
      <usagenotes>
        <usage resource="PropBank" version="1.0" inuse="-" />
        <usage resource="PropBank" version="2.1.5" inuse="-" />
        <usage resource="PropBank" version="3.1" inuse="-" />
        <usage resource="PropBank" version="3.4" inuse="-" />
        <usage resource="AMR" version="2019" inuse="+" />
        <usage resource="PropBank" version="Flickr 1.0" inuse="-" />
        <usage resource="AMR" version="Spatial 1.0" inuse="+" />
        <usage resource="AMR" version="THYME 1.0" inuse="+" />
      </usagenotes>
      <example name="family" src="instead of, in lieu of, in place of, rather than, as opposed to">
        <text>Tim went for an early morning bike ride instead of sleeping in .</text>
        <propbank>
          <arg end="7" start="0" type="ARG1">Tim went for an early morning bike ride</arg>
          <arg end="11" start="10" type="ARG2">sleeping in</arg>
        </propbank>
      </example>
      <example name="not A, but B" src="">
        <text>I 'm not angry , but disappointed .</text>
        <propbank>
          <arg end="6" start="6" type="ARG1">disappointed</arg>
          <arg end="2" start="0" type="ARG2">I 'm not</arg>
        </propbank>
      </example>
      <note>For AMR annotations.</note>
    </roleset>
  </predicate>
</frameset>