<?xml version="1.0" encoding="utf-8" standalone="no"?>
<!DOCTYPE frameset PUBLIC "-//PB//PropBank Frame v3.4 Transitional//EN" "http://propbank.org/specification/dtds/v3.4/frameset.dtd">
<frameset>
  <predicate lemma="sigmoid">
    <roleset id="sigmoid.01" name="in the sigmoid colon portion of the gi tract">
      <aliases>
        <alias pos="j">sigmoid</alias>
      </aliases>
      <roles>
        <role descr="region described as sigmoid" f="PPT" n="1"/>
      </roles>
      <usagenotes>
        <usage resource="PropBank" version="1.0" inuse="-"/>
        <usage resource="PropBank" version="2.1.5" inuse="-"/>
        <usage resource="PropBank" version="3.1" inuse="+"/>
        <usage resource="PropBank" version="3.4" inuse="+"/>
        <usage resource="AMR" version="2019" inuse="-"/>
        <usage resource="PropBank" version="Flickr 1.0" inuse="+"/>
        <usage resource="AMR" version="Spatial 1.0" inuse="-"/>
        <usage resource="AMR" version="THYME 1.0" inuse="-"/>
      </usagenotes>
      <lexlinks/>
      <example name="arg1" src="medi-tmprl">
        <text>I discussed the development , staging , and treatment of rectosigmoid cancer with the patient and his family members , including the need to discern whether this is truly rectal or more sigmoid , as this would affect rationale for neoadjuvant chemoradiation consideration if T3 or N1 disease is noted , versus consideration of adjuvant chemotherapy as this is more sigmoid and involves lymph nodes .</text>
        <propbank>
          <rel relloc="32">sigmoid</rel>
          <arg type="ARG1" start="26" end="26">this</arg>
          <arg type="ARGM-EXT" start="31" end="31">more</arg>
        </propbank>
      </example>
      <note>SIGMOID-J NOTES: Added by Julia based on medi-tmprl1to8. (from sigmoid.01-j)</note>
    </roleset>
  </predicate>
</frameset>