<?xml version="1.0" encoding="utf-8" standalone="no"?>
<!DOCTYPE frameset PUBLIC "-//PB//PropBank Frame v3.4 Transitional//EN" "http://propbank.org/specification/dtds/v3.4/frameset.dtd">
<frameset>
  <predicate lemma="distribution-range">
    <roleset id="distribution-range.91" name="distribution range (incl. for a normal distribution)">
      <aliases>
        <alias pos="n">distribution-range</alias>
        <alias pos="n">distribution</alias>
        <alias pos="n">range</alias>
      </aliases>
      <roles>
        <role descr="center, mean" f="VSP" n="1" />
        <role descr="lower bound" f="VSP" n="2" />
        <role descr="upper bound" f="VSP" n="3" />
        <role descr="radius, distance from center to bounds" f="VSP" n="4" />
        <role descr="confidence that value is in range, typically a percentage, e.g. 95%" f="VSP" n="5" />
        <role descr="deviation covered by range, e.g. standard-deviation, standard-error-of-the-mean" f="VSP" n="6" />
        <role descr="type of distribution, e.g. normal-distribution" f="VSP" n="7" />
      </roles>
      <usagenotes>
        <usage resource="PropBank" version="1.0" inuse="-" />
        <usage resource="PropBank" version="2.1.5" inuse="-" />
        <usage resource="PropBank" version="3.1" inuse="-" />
        <usage resource="PropBank" version="3.4" inuse="-" />
        <usage resource="AMR" version="2019" inuse="+" />
        <usage resource="PropBank" version="Flickr 1.0" inuse="-" />
        <usage resource="AMR" version="Spatial 1.0" inuse="+" />
        <usage resource="AMR" version="THYME 1.0" inuse="+" />
      </usagenotes>
      <example name="center and radius" src="">
        <text>142.0 &#177; 15.7 nM</text>
        <propbank>
          <rel relloc="3">nM</rel>
          <arg end="0" start="0" type="ARG1">142.0</arg>
          <arg end="3" start="2" type="ARG4">15.7 nM</arg>
        </propbank>
      </example>
      <example name="center and bounds" src="">
        <text>a range of 16.4%-19 % ( 17.7 % being the average )</text>
        <propbank>
          <rel relloc="1">range</rel>
          <arg end="7" start="5" type="ARG1">( 17.7 %</arg>
          <arg end="7" start="5" type="ARG2">( 17.7 %</arg>
          <arg end="0" start="0" type="ARG3">a</arg>
        </propbank>
      </example>
      <example name="with confidence percentage" src="">
        <text>With 95 % confidence , 42 - 45 % of voters will vote for John Smith .</text>
        <propbank>
          <rel relloc="12">vote</rel>
          <arg end="2" start="1" type="ARG2">95 %</arg>
          <arg end="2" start="1" type="ARG3">95 %</arg>
          <arg end="2" start="1" type="ARG5">95 %</arg>
        </propbank>
      </example>
      <example name="with standard-deviation" src="">
        <text>The gestational age was determined to be 28.5 weeks &#177; 10 days ( 2 standard deviations ) .</text>
        <propbank>
          <rel relloc="2">age</rel>
          <arg end="8" start="7" type="ARG1">28.5 weeks</arg>
          <arg end="11" start="10" type="ARG4">10 days</arg>
          <arg end="16" start="12" type="ARG6">( 2 standard deviations )</arg>
        </propbank>
      </example>
      <example name="with standard-error-of-the-mean" src="">
        <text>65 &#177; 3 % ( mean &#177; SEM )</text>
        <propbank>
          <rel relloc="5">mean</rel>
          <arg end="0" start="0" type="ARG1">65</arg>
          <arg end="3" start="1" type="ARG4">&#177; 3 %</arg>
          <arg end="8" start="7" type="ARG6">SEM )</arg>
        </propbank>
      </example>
      <note>For AMR annotations.</note>
    </roleset>
  </predicate>
</frameset>