<?xml version="1.0" encoding="utf-8" standalone="no"?>
<!DOCTYPE frameset PUBLIC "-//PB//PropBank Frame v3.4 Transitional//EN" "http://propbank.org/specification/dtds/v3.4/frameset.dtd">
<frameset>
  <predicate lemma="relook">
    <roleset id="relook.01" name="look at again">
      <aliases>
        <alias pos="v">relook</alias>
      </aliases>
      <roles>
        <role descr="looker" f="PAG" n="0" />
        <role descr="thing looked at/for/on" f="PPT" n="1" />
        <role descr="attribute of arg 1" f="PRD" n="2" />
      </roles>
      <usagenotes>
        <usage resource="PropBank" version="1.0" inuse="-" />
        <usage resource="PropBank" version="2.1.5" inuse="-" />
        <usage resource="PropBank" version="3.1" inuse="+" />
        <usage resource="PropBank" version="3.4" inuse="+" />
        <usage resource="AMR" version="2019" inuse="-" />
        <usage resource="PropBank" version="Flickr 1.0" inuse="+" />
        <usage resource="AMR" version="Spatial 1.0" inuse="-" />
        <usage resource="AMR" version="THYME 1.0" inuse="+" />
      </usagenotes>
      <example name="args 0 and 1" src="">
        <text>When he sees Dr. Montoya , we will relook at this .</text>
        <propbank>
          <rel relloc="8">relook</rel>
          <arg type="ARGM-TMP" start="0" end="4">When he sees Dr. Montoya</arg>
          <arg type="ARG0" start="6" end="6">we</arg>
          <arg type="ARGM-MOD" start="7" end="7">will</arg>
          <arg type="ARG1" start="9" end="10">at this</arg>
        </propbank>
      </example>
      <note>RELOOK-V NOTES: Based on sentences in Temprel data. Comparison to look.01. No VN class. Framed by Katie. (from relook.01-v)</note>
    </roleset>
  </predicate>
</frameset>
