<?xml version="1.0" encoding="utf-8" standalone="no"?>
<!DOCTYPE frameset PUBLIC "-//PB//PropBank Frame v3.4 Transitional//EN" "http://propbank.org/specification/dtds/v3.4/frameset.dtd">
<frameset>
  <predicate lemma="hepatobiliary">
    <roleset id="hepatobiliary.01" name="of the liver, gall bladder and bile ducts">
      <aliases>
        <alias pos="j">hepatobiliary</alias>
      </aliases>
      <roles>
        <role descr="hepatobiliary entity" f="PPT" n="1" />
      </roles>
      <usagenotes>
        <usage resource="PropBank" version="1.0" inuse="-" />
        <usage resource="PropBank" version="2.1.5" inuse="-" />
        <usage resource="PropBank" version="3.1" inuse="+" />
        <usage resource="PropBank" version="3.4" inuse="+" />
        <usage resource="AMR" version="2019" inuse="-" />
        <usage resource="PropBank" version="Flickr 1.0" inuse="+" />
        <usage resource="AMR" version="Spatial 1.0" inuse="-" />
        <usage resource="AMR" version="THYME 1.0" inuse="-" />
      </usagenotes>
      <lexlinks />
      <example name="hepatobiliary-j: arg1" src="">
        <text>Given her history of the hepatic abscess and percutaneous biliary catheter , we will keep watch for signs and symptoms of infection that are hepatobiliary in nature as well and continue her chronic cephalosporin prophylaxis .</text>
        <propbank>
          <rel relloc="24">hepatobiliary</rel>
          <arg type="R-ARG1" start="22" end="22">that</arg>
          <arg type="ARG1" start="17" end="21">signs and symptoms of infection</arg>
          <arg type="ARGM-ADV" start="25" end="26">in nature</arg>
          <arg type="ARGM-ADV" start="27" end="28">as well</arg>
        </propbank>
      </example>
      <note>HEPATOBILIARY-J NOTES: Added by Julia based on medi-tmprl1to8. (from hepatobiliary.01-j)</note>
    </roleset>
  </predicate>
</frameset>