<?xml version="1.0" encoding="utf-8" standalone="no"?>
<!DOCTYPE frameset PUBLIC "-//PB//PropBank Frame v3.4 Transitional//EN" "http://propbank.org/specification/dtds/v3.4/frameset.dtd">
<frameset>
  <predicate lemma="friable">
    <roleset id="friable.01" name="fragile, crumbly, easily broken">
      <aliases>
        <alias pos="j">friable</alias>
      </aliases>
      <roles>
        <role descr="causer of fragility" f="PAG" n="0" />
        <role descr="friable thing" f="PPT" n="1" />
      </roles>
      <usagenotes>
        <usage resource="PropBank" version="1.0" inuse="-" />
        <usage resource="PropBank" version="2.1.5" inuse="-" />
        <usage resource="PropBank" version="3.1" inuse="+" />
        <usage resource="PropBank" version="3.4" inuse="+" />
        <usage resource="AMR" version="2019" inuse="-" />
        <usage resource="PropBank" version="Flickr 1.0" inuse="+" />
        <usage resource="AMR" version="Spatial 1.0" inuse="-" />
        <usage resource="AMR" version="THYME 1.0" inuse="+"/>
      </usagenotes>
      <lexlinks />
      <example name="arg1" src="medi-tmprl">
        <text>This is mobile and friable with blood present on the examining glove .</text>
        <propbank>
          <rel relloc="4">friable</rel>
          <arg type="ARG1" start="0" end="0">This</arg>
          <arg type="ARGM-ADV" start="5" end="11">with blood present on the examining glove</arg>
        </propbank>
      </example>
      <note>FRIABLE-J NOTES: Added by Julia based on medi-tmprl1to8. (from friable.01-j)</note>
    </roleset>
  </predicate>
</frameset>