<?xml version="1.0" encoding="utf-8" standalone="no"?>
<!DOCTYPE frameset PUBLIC "-//PB//PropBank Frame v3.4 Transitional//EN" "http://propbank.org/specification/dtds/v3.4/frameset.dtd">
<frameset>
  <predicate lemma="backward">
    <roleset id="backward.01" name="slow in progress, feeble-minded in some aspect">
      <aliases>
        <alias pos="j">backward</alias>
      </aliases>
      <roles>
        <role descr="entity that is slow on the uptake" f="PAG" n="1" />
        <role descr="subject that arg1 is slow in, backward on" f="PPT" n="2" />
      </roles>
      <usagenotes>
        <usage resource="PropBank" version="1.0" inuse="-" />
        <usage resource="PropBank" version="2.1.5" inuse="-" />
        <usage resource="PropBank" version="3.1" inuse="+" />
        <usage resource="PropBank" version="3.4" inuse="+" />
        <usage resource="AMR" version="2019" inuse="-" />
        <usage resource="PropBank" version="Flickr 1.0" inuse="+" />
        <usage resource="AMR" version="Spatial 1.0" inuse="-" />
        <usage resource="AMR" version="THYME 1.0" inuse="-" />
      </usagenotes>
      <lexlinks />
      <example name="All args" src="web">
        <text>Republicans have been losing political clout and power because they are so backward on social issues .</text>
        <propbank>
          <rel relloc="12">backward</rel>
          <arg type="ARG1" start="9" end="9">they</arg>
          <arg type="ARGM-EXT" start="11" end="11">so</arg>
          <arg type="ARG2" start="13" end="15">on social issues</arg>
        </propbank>
      </example>
      <example name="Arg 2 expressed as &quot;when&quot; phrase" src="BOLT P01, parts 2,3">
        <text>My sister is a primary school teacher and teachers generally hate the tories , before all this pension business came to the surface but because they 're so backward when it comes to education .</text>
        <propbank>
          <rel relloc="28">backward</rel>
          <arg type="ARG1" start="25" end="25">they</arg>
          <arg type="ARGM-EXT" start="27" end="27">so</arg>
          <arg type="ARG2" start="29" end="33">when it comes to education</arg>
        </propbank>
      </example>
      <note>BACKWARD-J NOTES: Roleset based on instances in BOLT P01, parts 2,3. Framed by Claire. (from backward.01-j)</note>
    </roleset>
    <roleset id="backward.02" name="directed or facing backward">
      <aliases>
        <alias pos="j">backward</alias>
      </aliases>
      <roles>
        <role descr="backward facing thing" f="PPT" n="1" />
        <role descr="backward from what -- correctly oriented point of comparison" f="PPT" n="2" />
      </roles>
      <usagenotes>
        <usage resource="PropBank" version="1.0" inuse="-" />
        <usage resource="PropBank" version="2.1.5" inuse="-" />
        <usage resource="PropBank" version="3.1" inuse="+" />
        <usage resource="PropBank" version="3.4" inuse="+" />
        <usage resource="AMR" version="2019" inuse="-" />
        <usage resource="PropBank" version="Flickr 1.0" inuse="+" />
        <usage resource="AMR" version="Spatial 1.0" inuse="-" />
        <usage resource="AMR" version="THYME 1.0" inuse="-" />
      </usagenotes>
      <lexlinks />
      <example name="All args" src="web">
        <text>That seal actually needs to keep air from entering more than oil from escaping - it 's backward from what you might expect .</text>
        <propbank>
          <rel relloc="17">backward</rel>
          <arg type="ARG1" start="15" end="15">it</arg>
          <arg type="ARG2" start="18" end="22">from what you might expect</arg>
        </propbank>
      </example>
      <note>BACKWARD-J NOTES: (from backward.02-j)</note>
    </roleset>
  </predicate>
</frameset>