<?xml version="1.0" encoding="utf-8" standalone="no"?>
<!DOCTYPE frameset PUBLIC "-//PB//PropBank Frame v3.4 Transitional//EN" "http://propbank.org/specification/dtds/v3.4/frameset.dtd">
<frameset>
  <predicate lemma="falsify">
    <roleset id="falsify.01" name="to forge or misrepresent">
      <aliases>
        <alias pos="v">falsify</alias>
      </aliases>
      <roles>
        <role descr="faker, agent" f="PAG" n="0" />
        <role descr="entity falsified" f="PPT" n="1" />
      </roles>
      <usagenotes>
        <usage resource="PropBank" version="1.0" inuse="+" />
        <usage resource="PropBank" version="2.1.5" inuse="+" />
        <usage resource="PropBank" version="3.1" inuse="+" />
        <usage resource="PropBank" version="3.4" inuse="+" />
        <usage resource="AMR" version="2019" inuse="+" />
        <usage resource="PropBank" version="Flickr 1.0" inuse="+" />
        <usage resource="AMR" version="Spatial 1.0" inuse="+" />
        <usage resource="AMR" version="THYME 1.0" inuse="+" />
      </usagenotes>
      <lexlinks>
        <lexlink class="Forging" confidence="0.8" resource="FrameNet" src="manual+strict-conv" version="1.7" />
        <lexlink class="falsify-v.1" confidence="0.1" resource="onsense" src="annot-overlap" version="on5">3</lexlink>
      </lexlinks>
      <example name="transitive" src="">
        <text>Tony was four years older than most of his fellow cadets , and gained admission to the academy because his brother had falsified his birth certificate .</text>
        <propbank>
          <rel relloc="22">falsified</rel>
          <arg type="ARG0" start="19" end="20">his brother</arg>
          <arg type="ARG1" start="23" end="25">his birth certificate</arg>
        </propbank>
      </example>
      <note>FALSIFY-V NOTES: Frames file for 'falsify' based on survey of sentences in the WSJ corpus. (from falsify.01-v predicate notes)</note>
    </roleset>
  </predicate>
</frameset>